{
  "dataset": "AIO CODE AI + Social Baseline",
  "version": "1.5",
  "updated": "2026-10-06",
  "baseline_target": "MC-001 BASELINE v1",
  "purpose": "Container and specification for the first dated empirical snapshot across AI systems, search environments and relevant platforms, measured after the prior interventions declared in the baseline plan.",
  "important_note": "Version 1.5 connects prior DEOS integration, historical journals and visually reviewed historical cuts with October 6. Frozen records and 14/49 coverage remain unchanged. Raw images and full original journals stay restricted.",
  "entities": [
    {
      "entity_id": "MC-001",
      "canonical_name": "Marii Cuadros"
    },
    {
      "entity_id": "NUX-001",
      "canonical_name": "NUX"
    },
    {
      "entity_id": "AIO-001",
      "canonical_name": "AIO CODE"
    }
  ],
  "primary_baseline_entity": "MC-001",
  "prompt_registry_ref": "prompt-registry-v1.json",
  "prompt_registry_version": "1.0",
  "observatory_protocol_ref": "OBSERVATORY-PROTOCOL-v1.md",
  "representation_rubric_ref": "RECOGNITION-RUBRIC-v1.md",
  "measurement_fields": [
    "baseline_id",
    "observation_id",
    "timestamp",
    "entity_id",
    "system",
    "system_interface_or_model_if_visible",
    "prompt_id",
    "prompt_registry_version",
    "prompt_text",
    "language",
    "context_condition",
    "environment",
    "observed_representation",
    "response_snapshot_or_ref",
    "sources_or_citations",
    "evaluation",
    "evidence_state",
    "notes",
    "research_window_id",
    "related_intervention_ids"
  ],
  "records": [
    {
      "observation_id": "OBS-CHATGPT-WEB-AIO-01-20260925-ANON",
      "timestamp": "2026-09-25T00:08:26.712Z",
      "entity_id": "MC-001",
      "system": "chatgpt-web",
      "prompt_id": "AIO-01",
      "prompt_registry_version": "1.0",
      "response_snapshot_or_ref": "What is AIO CODE?\n\n“AIO CODE” can mean different things depending on the context. It is not a single universally recognized term. Common meanings include:\n\nAI-oriented code / AI code (sometimes written informally as AIO code)\n\nCode written for or with the help of artificial intelligence tools.\n\nCould refer to software that uses AI models, machine learning, automation, or AI-assisted programming.\n\nAIO = All-In-One code\n\nIn software or hardware contexts, “AIO code” may refer to a single integrated codebase or configuration that combines multiple functions into one package.\n\nExample: an “all-in-one” script that handles setup, deployment, and configuration.\n\nAIO in web/search contexts: Artificial Intelligence Optimization\n\n“AIO” is sometimes used for optimizing content to appear in AI-generated answers (similar to SEO, but aimed at AI search systems).\n\n“AIO code” in this context might mean code or markup intended to improve how AI systems understand or retrieve information.\n\nA specific product, platform, or project name\n\nSome companies or developers use “AIO Code” as a brand name for coding tools, frameworks, or services.\n\nIf you mean AIO Code as a tool, programming language, website, app, or something you saw in a particular place, tell me where you encountered the term (for example: GitHub, a course, a job post, a software screen, or a website), and I can identify the exact meaning.\n\nChatGPT is AI and can make mistakes.",
      "research_window_id": "MC-001-BASELINE-v1",
      "related_intervention_ids": [
        "INT-MC-001-20260924-001",
        "INT-AIO-001-20260924-001"
      ]
    },
    {
      "observation_id": "OBS-CHATGPT-WEB-CAT-01-20260925-ANON",
      "timestamp": "2026-09-25T00:08:26.712Z",
      "entity_id": "MC-001",
      "system": "chatgpt-web",
      "prompt_id": "CAT-01",
      "prompt_registry_version": "1.0",
      "response_snapshot_or_ref": "What is VOID MODE in relation to Marii Cuadros?\n\n\nIn relation to Marii Cuadros, VOID MODE appears to be a creative concept and visual language developed by Marii Cuadros, connected to her broader creative ecosystem called AIO CODE. \nMariicuadros\n+1\n\nAccording to the project’s own documentation, VOID MODE is not described as a single product or a software mode, but as a framework for exploring:\n\nvisual identity and aesthetic systems\n\nimage, music, movement, and presence\n\ndigital-era artistic expression\n\ncreative direction and curation \nMariicuadros\n+1\n\nThe concept is expressed through a series of “ARCHIVE” projects, where each archive combines a musical reference, visual style, and conceptual theme. Examples include: \nMariicuadros\n+1\n\nARCHIVE 01 — 122 BPM: associated with Afrohouse, a “Muted Cyber” visual protocol, and a more energetic VOID MODE expression. \nMariicuadros\n\nARCHIVE 02 — 96 BPM: associated with reggaetón and the concept “Perreo Down,” focusing on movement and bodily presence. \nMariicuadros\n\nARCHIVE 03 — 82 BPM: associated with R&B, “Frecuencia Silencio,” and a quieter, more minimal aesthetic. \nMariicuadros\n\nThe relationship between the two names is described as:\n\nMarii Cuadros → creator/artist\nVOID MODE → creative language / visual-conceptual division\nAIO CODE → broader research and digital identity project \nMariicuadros\n\nA concise interpretation: VOID MODE is Marii Cuadros’ artistic universe for translating identity, sound, movement, and digital aesthetics into a recognizable creative system. \nMariicuadros\n+1\n\nI should note that the available information about VOID MODE comes primarily from Marii Cuadros’ own published documentation rather than independent coverage, so descriptions of its meaning reflect the project’s self-definition. \nMariicuadros\n+1\n\nFuentes\nChatGPT es IA y puede cometer errores.",
      "research_window_id": "MC-001-BASELINE-v1",
      "related_intervention_ids": [
        "INT-MC-001-20260924-001",
        "INT-AIO-001-20260924-001"
      ]
    },
    {
      "observation_id": "OBS-CHATGPT-WEB-DIS-01-20260925-ANON",
      "timestamp": "2026-09-25T00:08:26.712Z",
      "entity_id": "MC-001",
      "system": "chatgpt-web",
      "prompt_id": "DIS-01",
      "prompt_registry_version": "1.0",
      "response_snapshot_or_ref": "Is Marii Cuadros the same person as Maria Luisa Cuadros?\n\nI couldn’t find reliable public information confirming that Marii Cuadros and Maria Luisa Cuadros are the same person. The search results I found mostly point to businesses or unrelated references involving “Maria Luisa” and “Cuadros,” rather than a person named Marii Cuadros. \nCuadros Malu\n+1\n\nIt’s possible that:\n\n“Marii Cuadros” is a nickname, shortened name, or social media handle for someone whose legal name is Maria Luisa Cuadros; or\n\nthey are different people.\n\nIf you share where you saw “Marii Cuadros” (for example, Instagram, a news article, an artist profile, a company page, or a country), I can help verify whether they refer to the same individual.\n\nFuentes\nChatGPT es IA y puede cometer errores.",
      "research_window_id": "MC-001-BASELINE-v1",
      "related_intervention_ids": [
        "INT-MC-001-20260924-001",
        "INT-AIO-001-20260924-001"
      ]
    },
    {
      "observation_id": "OBS-CHATGPT-WEB-ENT-01-20260925-ANON",
      "timestamp": "2026-09-25T00:08:26.712Z",
      "entity_id": "MC-001",
      "system": "chatgpt-web",
      "prompt_id": "ENT-01",
      "prompt_registry_version": "1.0",
      "response_snapshot_or_ref": "Who is Marii Cuadros?\n\nI couldn’t find a widely recognized public figure specifically named “Marii Cuadros”. The name may refer to a private individual, a social media username, or a person whose information is not broadly indexed online.\n\nA few related matches appear, but they don’t clearly identify the person you mean:\n\nMariaCuadros is the name of a Chilean home-decor/art brand that sells framed artwork and decorative products; it describes itself as a group of friends focused on decoration and design. \nMariaCuadros\n+1\n\nThere are many people with the surname Cuadros and first name María on professional networks, but no single “Marii Cuadros” profile stands out as a notable public figure. \nlinkedin.com\n\nIf you mean a specific Marii Cuadros (for example, from TikTok, Instagram, music, a company, a city, or a news story), tell me where you saw the name and I can narrow it down.\n\nFuentes\nChatGPT es IA y puede cometer errores.",
      "research_window_id": "MC-001-BASELINE-v1",
      "related_intervention_ids": [
        "INT-MC-001-20260924-001",
        "INT-AIO-001-20260924-001"
      ]
    },
    {
      "observation_id": "OBS-CHATGPT-WEB-ENT-02-20260925-ANON",
      "timestamp": "2026-09-25T00:08:26.712Z",
      "entity_id": "MC-001",
      "system": "chatgpt-web",
      "prompt_id": "ENT-02",
      "prompt_registry_version": "1.0",
      "response_snapshot_or_ref": "¿Quién es Marii Cuadros?\n\nNo encuentro una figura pública ampliamente conocida con el nombre exacto “Marii Cuadros”. Los resultados disponibles apuntan a varios perfiles con nombres parecidos (por ejemplo, María Cuadros o Maryi Cuadros) pero no permiten identificar con seguridad a una persona concreta. \nlinkedin.com\n+1\n\nSi te refieres a una Marii Cuadros específica (por ejemplo, una influencer, artista, persona de TikTok/Instagram, política, escritora, etc.), dime algún dato adicional como:\n\npaís o ciudad,\n\ndónde viste el nombre,\n\nusuario de redes,\n\nprofesión o contexto,\n\ny puedo ayudarte a identificarla.\n\nFuentes\nChatGPT es IA y puede cometer errores.\n\nDictar\n⌃\n⇧\nD",
      "research_window_id": "MC-001-BASELINE-v1",
      "related_intervention_ids": [
        "INT-MC-001-20260924-001",
        "INT-AIO-001-20260924-001"
      ]
    },
    {
      "observation_id": "OBS-CHATGPT-WEB-REC-01-20260925-ANON",
      "timestamp": "2026-09-25T00:08:26.712Z",
      "entity_id": "MC-001",
      "system": "chatgpt-web",
      "prompt_id": "REC-01",
      "prompt_registry_version": "1.0",